Organization,abstract,address,bidders,categories,closing_date,competitionNumber,linkTo,status,title
"Duffley, Brenda","BID BOND:  10% of Bid Amount 
 
CONTRACT NO.  19ECS-TI-05MR 
 
NOTE: 
 
This call document is available for purchase and download online on our website. 
Please see all the attachments posted on our website. 
 
Drawings:   
 
Tender Drawings are available on CD to purchasers of the tender document.  Bidders must obtain a copy of the CD from the Tender Office of the Purchasing and Materials Management Division, 19th Floor, West Tower, City Hall, 100 Queen Street West, Toronto, during regular business hours (8:30 a.m. to 4:30 p.m.).  
Proof of Tender purchase will be required to pick-up the CD.  The vendors who have not purchased the Tender document will have to do so in order to obtain a copy of the CD.  
 
SCOPE OF WORK: 
Repair deficient sidewalks, curb, curb & gutter, medians and roadbase; Curb re-alignment; Major road resurfacing; Decommissioning of existing 150mm Cast Iron Watermain; Transfer of existing water services and hydrants from existing 150mm cast iron watermain to existing 300mm diameter PVC watermain; and the removal and replacement of existing tee/crossing connections from the existing 150mm and 300mm watermains with filler pieces. 
Completion Date 
This Contract, including all site restorations, clean up, and rectification of all known deficiencies, must be completed by no later than September 14, 2019. 
  
MANDATORY EXPERIENCE AND QUALIFICATIONS: 
 
The Bidder must have the following experience in order to be considered for award: 
 
1.	Must have completed and must have achieved Substantial Completion within the meaning of the Construction Lien Act for at least three (3) projects within the past 5 years as General Contractor involving milling and resurfacing of existing asphalt pavement, removal and replacement of existing curb, curb and gutter and sidewalk and construction of new sidewalks, having a minimum dollar value of $2,000,000.00 Canadian Dollars each (excluding taxes). At least one of these projects must have involved staged/phased construction activities involving traffic control and traffic management on an arterial road (4 to 6 lanes). 
 
 2.  Must have completed and must have achieved Substantial Completion within the meaning of the Construction Lien Act for at least one project, within the past 3 years as General Contractor involving watermain and water services replacement, having a minimum dollar value of $500,000.00 Canadian Dollars (excluding taxes).
 
 
 
 
","City Hall, 19th Floor West Tower",,"Construction Services, Road - Curb - Sidewalk","March 6, 2019",61-2019,"https://wx.toronto.ca/inter/pmmd/calls.nsf/0/074D84A86E2930DB8525839E00608787/$file/Tender 61-2019  Notice of Intended Procurement.pdf,https://wx.toronto.ca/inter/pmmd/calls.nsf/0/074D84A86E2930DB8525839E00608787/$file/Tender 61-2019 Viewing Copy.pdf",***,Major Road Resurfacing on Scarlett Road 
,,,,,,,,,
"Hampton, Richard","The Contractor will be responsible for providing all the necessary resources to carry out, but not limited to, the following activities related to this project: 
The work in this contract includes the maintenance program for asphalt patching to existing asphalt surfaces on various City of Toronto streets in the North York District, as well as in the Etobicoke York District during the 2019 construction season.  
COMMENCEMENT AND COMPLETION DATE 
The Contractor will be notified of the exact start date by the issuance of a Commencement Letter by the City of Toronto. The tentative start date is May 1st, 2019.  
Work shall be initiated in the North York District, and all working lists shall be completed, including deficiencies and joint sealing, before the Contractor initiates any work within the Etobicoke District. 
If the contractor fails to commence the work on the date requested by the Contract Administrator, the City may terminate the contractor's right to continue the work and/or cancel the contract in whole. Additionally, the City reserves the right to cancel or terminate the contract at any time. 
The Contractor agrees to complete the entire work, within both Districts, comprising the contract within a time period of eighty five (85) calendar days from the date of the written order to commence work, Commencement Letter date. 
Failure to complete the work as specified will result in Clause 17 of Section 5A being applied. 
The Contractor shall complete all of the work outlined in this contract including any deficiencies, and remove equipment, signs and materials to make the locations clean and safe within the time given.  
A written Order to Commence work will follow once the contract is executed and all required documentation has been received by the City. However, in light of ongoing difficulties in obtaining timely utility locates you may wish to begin requesting locates as soon as the contract is awarded so as to avoid unnecessary delays to the work. Please note that requesting locates in advance of the order to commence work is at your own risk and the City will not be responsible for added costs incurred prior to contract execution in the event of stale locates or a failure by you to execute the contract, etc.
 
 
 
 
","City Hall, 18th Floor West Tower",,"Construction Services, Road - Curb - Sidewalk","February 22, 2019",53-2019,"https://wx.toronto.ca/inter/pmmd/calls.nsf/0/CAE82AD412A9B2FE8525839A0072F701/$file/53-2019 notice_intended_procurement.pdf,https://wx.toronto.ca/inter/pmmd/calls.nsf/0/CAE82AD412A9B2FE8525839A0072F701/$file/53-2019 - Viewing Copy.pdf",***,"'Hot-in-Place' Asphalt Patching in various City of Toronto locations, North York District and Etobicoke York District"
,,,,,,,,,
"Porcarelli, Michael","Supply all labour, equipment and materials to Installation of New Residential Water and Sewer Service Connections and Associated Works – Etobicoke York District (Wards: 1, 2, 3, 4, 5, 7)
 
 
 
","City Hall, 19th Floor West Tower",,"Construction Services, Sewer repair and maintenance","March 6, 2019",Notice36-2019,https://wx.toronto.ca/inter/pmmd/calls.nsf/0/F3728D8A2CABB3A985258392006568DD/$file/36-2019 NOIP.pdf,***,"New Residential Water and Sewer Service Connections and Associated Works – Etobicoke York District (Wards: 1,2,3,4,5,7)"
,,,,,,,,,
"Duffley, Brenda","BID BOND:  10% of Bid Amount 
CONTRACT NO.  18ECS-TI-04LR 
 
NOTE: 
 
This call document is available for purchase and download online on our website. 
Please see all the attachments posted on our website. 
 
Drawings:   
 
Tender Drawings are available on CD to purchasers of the tender document.  Bidders must obtain a copy of the CD from the Tender Office of the Purchasing and Materials Management Division, 19th Floor, West Tower, City Hall, 100 Queen Street West, Toronto, during regular business hours (8:30 a.m. to 4:30 p.m.).  
Proof of Tender purchase will be required to pick-up the CD.  The vendors who have not purchased the Tender document will have to do so in order to obtain a copy of the CD.  
 
SCOPE OF WORK: 
 
Road Reconstruction on Riverside Drive, Riverside Trail, Morningside Avenue And Replacement Of Substandard Water Services; Construction of New Sidewalk On Riverside Drive; Installation of Custom made Multi-Purpose Metal Guide Rail; Landscape Improvements including Tree Planting , Construction of Bioretention  Cell and Bioswales; and Road Resurfacing on Riverside Crescent. 
 
Completion Date 
This Contract, including all site restorations, clean up, and rectification of all known deficiencies, must be completed within 140 Working Days from the date of commencement of the Work. 
 
MANDATORY EXPERIENCE AND QUALIFICATIONS: 
 
The bidder must have the following experience in order to be considered for award: 
 
Corporate Experience 
 
1.  Must have completed a minimum of three road reconstruction projects with a minimum value of $3,500,000.00 Canadian dollars each (excluding taxes) within in the City of Toronto. 
 
2.  Must have completed a minimum of two projects involving landscape improvements, tree plantings and/or Low Impact Developments (LID) with a minimum value of $70,000.00 Canadian dollars each (excluding taxes). 
 
Personell Experience 
 
The General Contractors or Subcontractors performing LID work scope must demonstrate the following experience in order to be considered for award: 
•	The proposed project manager and site supervisor have completed two landscape and/or Low Impact Development (LID) related projects, each with a minimum value of $70,000.00 Canadian dollars (excluding taxes), that includes the successful installation, commissioning and operation of LID infrastructure within the last five years, and; 
•	The proposed project manager and site supervisor have completed the 
        Sustainable Technologies Evaluation Program course “Learn to Construct LID” or have completed an equivalent course/certification in LID construction and certification within the last five years. 
 
For the purposes of demonstrating experience in LID infrastructure installation, reference projects may include the following types of LIDs (refer to the City’s Green Streets Technical Guidelines for further information regarding the LIDs identified below): 
•	Bioretention features, include bioretention planters, bioretention curb 
        extensions/bump-outs, bioretention cells, and rainwater gardens 
•	Stormwater tree pits 
•	Stormwater tree trenches 
•	Swales, including enhanced grass swales, bioswales, and bioswales with 
        stone walls 
•	Green gutters 
•	Filter strips 
•	Underground infiltration systems, including drainage wells, perforated 
        pipe systems, soakaways, infiltration trenches, and infiltration cells 
•	Rainwater cisterns 
•	Tree planting 
•	Shrub planting
 
 
 
 
","City Hall, 19th Floor West Tower",,"Construction Services, Road - Curb - Sidewalk","February 26, 2019",Apr-19,"https://wx.toronto.ca/inter/pmmd/calls.nsf/0/9E785A0B04D920F88525839B0071C941/$file/Tender 4-2019 -  Notice of Intended Procurement.pdf,https://wx.toronto.ca/inter/pmmd/calls.nsf/0/9E785A0B04D920F88525839B0071C941/$file/Tender 4-2019 - Viewing Copy.pdf",***,Local Road Reconstruction and Replacement of Substandard Water Services 
,,,,,,,,,
"Salcedo, Alma","NOTE: Addendum 3 Attachments and Revisions are in CD format and CD is available to pick up at the Purchasing & Materials Management Division Tender Office, located on the 19th Floor, West Tower, City Hall, 100 Queen Street West, Toronto ON. There is no additional cost for the CD. Please provide your online proof of purchase.  
 
 
 
 
BID BOND:  10% of Bid Amount 
CONTRACT NO.  19ECS-TI-01SP 
NOTE: 
 
This call document is available for purchase and download through the City of Toronto's Online Call Document System: 
 
 
A non-refundable fee (shown above) is required for each call document. 
 
Drawings:   
 
Drawings and attachments are available on CD to the bidders who have purchased the tender document. Bidders may pick up a copy of the CD from the Tender Office of Purchasing and Materials Management Division, 19th floor, West Tower, 100 Queen Street West during regular business hours (8.30 a.m. to 4.30 p.m.).  
 
Proof of Tender purchase will be required to pick-up the CD. The bidders who have not purchased the Tender document will have to do so before being given a copy of the CD 
 
SCOPE OF WORK: 
 
Part 1-Parkside Bridge Rehabilitation 
 
This Contract entails the rehabilitation of the The Queensway over Parkside Drive Bridge. The scope of work includes the following: 
 
•	Survey and layout; 
•	Traffic and pedestrian control and protection and construction staging including hoarding for pedestrian walkway for the duration of construction; 
•	Supply, install, maintain and remove the access and protection which shall also include a working and debris platform for the work; 
•	Survey and provide utility locates and provide necessary provisions to ensure continued utilities services; 
•	Provide temporary support to existing utility poles at approaches; 
•	Remove and replace underpass luminaires and install temporary lighting for vehicles and pedestrians;   
•	Supply, install, maintain and remove environmental protection for coating structural steel and handrails in the Toronto Transit Commission (TTC) stair wells; 
•	Temporarily remove, store, and reinstall pedestrian handrails at Parkside Dr.; 
•	Remove existing asphalt and waterproofing; 
•	Remove and replace bird screens; 
•	Remove delaminated and deteriorated concrete from deck top surface, exterior sidewalks and curbs, soffit, retaining walls, TTC staircase walls and stair landing as directed by the Contractor Administrator; concrete patch repair to above elements;  
•	Remove existing parapet walls and construct new parapet walls with railings;  
•	Remove and reconstruct bridge approaches, including approach slabs, curbs, and sidewalks; 
•	Remove ballast walls and curtain walls and construct new ballast wall integrated with new wingwall; 
•	Remove deck ends including expansion joint assembly, and construct deck end extension for semi-integral abutment conversion; 
•	Remove delaminated and deteriorated concrete from abutment walls and reface the abutments; apply concrete sealer to the finished concrete abutment surface; 
•	Remove top portion of retaining walls; remove loose and deteriorated facing masonry and coping at the retaining walls, and reinstall facing masonry and coping; re-grout masonry joints;  
•	Remove and reconstruct TTC stair steps; 
•	Construct new toe wall and structural sidewalk on grade; 
•	Install new waterproofing on deck and repave; apply additional membrane reinforcement over all construction joints; 
•	Replace bridge bearings by bridge jacking, including temporary support and jacking brackets; 
•	Reconstruct bearing seats at abutments; 
•	Remove and replace abutment steel diaphragms, and install new bearing stiffeners. 
Part 2-KQR Construction 
This section includes the complete reconstruction of these sections of roadway including sewer, water, roadways, curb, sidewalk signals, and TTC track as well as other miscellaneous works 
The scope of work includes, but is not limited to, the following: 
 
•	Traffic and pedestrian control for the duration of construction; 
•	Supply, install, maintain and remove the access and protection which shall include a working and debris platform for the work; 
•	Survey and provide utility locates; provide necessary provisions to ensure continued services of utilities; 
•	Abandon and replace existing storm and combined sewers 
•	Abandon and replace existing water mains 
•	Excavate and restore existing roadways 
•	Remove and replace exiting sidewalks and curb 
•	Remove and replace existing TTC track 
•	Remove and install new TTC pole bases and poles 
•	Construct concrete retaining walls 
All as shown on the Contract Drawings 
Part 3-Roncesvalles Bump-Out Retrofit Construction  
This section involves the upgrade of the existing TTC bump outs located on Roncesvalles as other miscellaneous works. 
The scope of work includes: 
•	Remove and replace curb 
•	Remove and replace asphalt 
•	Remove and replace tactile surfaces 
All as shown on the Contract Drawings 
Completion Date 
This Contract, including all site restorations, clean up, and rectification of all known deficiencies, must be completed by the following: 
 
Part 1 	This Contract, including all site restorations, clean up, and rectification of all known deficiencies, must be completed within 352 Working Days from the date of commencement of the Work indicated in the Order to Commence Work which will be issued following the execution of the agreement for this Contract. 
 
Part 2		May 15, 2020 
 
Part 3		June 5, 2019 
 
MANDATORY EXPERIENCE AND QUALIFICATIONS: 
 
The Bidder must have the following experience in order to be considered for award: 
 
1.	In the past five (5) years, the Bidder must have succesfully completed, as the General Contractor at least three (3) Track/Streetcar Rehabilitation projects in an urban environment having a minimum dollar value of $750,000 Canadian Dollars each (excluding taxes). All of these projects must have involved staged/phased construction activities where the Bidder can demonstrate experience in coordination of rail track activities with the urban streetcar unionized rail authority staff. 
 
The Bidder or it's Sub-Contractor must have the following experience in order to be considered for award: 
 
2.	In the past five (5) years, the Bidder or its Sub-Contractor must have successfully completed, as the General Contractor or Sub-Contractor, two (2) bridge projects, with an aggregate value of $4,000,000.00 (excluding HST) total or three (3) bridge projects with an aggregate value of $5,000,000.00 (excluding HST) total, each with a value in excess of $1,500,000.00 (excluding HST). At least one of these projects must have involved bridge rehabilitation / improvement work on a minimum 4-lane roadway in a municipality. 
 
In order to prove they have the required experience, the Bidder shall complete and submit the Experience and Qualifications Form as contained in Section 3 – Tender Submission Package as part of their Tender submission and provide the following information: 
 
•	Project description, that is location, scope of work, project value and contract number; 
•	Approval authority contact along with telephone or e-mail information; 
•	Owner contact information; 
•	Consultant contact information (if applicable) and; 
•	List of Sub-Contractors for each project.
 
 
 
 
","City Hall, 19th Floor West Tower",,"Construction Services, Road - Curb - Sidewalk","February 22, 2019",287-2018,"https://wx.toronto.ca/inter/pmmd/calls.nsf/0/80AC0ED6AB6FD37885258389006C3D47/$file/287-2018 - Viewing Copy.pdf,https://wx.toronto.ca/inter/pmmd/calls.nsf/0/80AC0ED6AB6FD37885258389006C3D47/$file/287-2018  NOIP rev1.pdf,https://wx.toronto.ca/inter/pmmd/calls.nsf/0/80AC0ED6AB6FD37885258389006C3D47/$file/Addendum 1 - 287-2018.pdf,https://wx.toronto.ca/inter/pmmd/calls.nsf/0/80AC0ED6AB6FD37885258389006C3D47/$file/Addendum 2 - 287-2018.pdf,https://wx.toronto.ca/inter/pmmd/calls.nsf/0/80AC0ED6AB6FD37885258389006C3D47/$file/Addendum 3 - 287-2018.pdf",***,"Reconstruction of TTC Track allowance, road, sidewalk, watermain, sewer, streetscaping and TTC platforms"
,,,,,,,,,
"Duffley, Brenda","#Doc1630064576 - Request for Tender for Permanent repairs to Utility Cuts on arterial, collector and local roads within Ward 5 (Etobicoke York District) #19EY-102TU. 
 
 
LINK TO PUBLIC POSTING ARIBA DISCOVERY: 
	 
 
 
IMPORTANT NOTICE – Transition to City's new Source-to-pay tool – SAP Ariba 
 
As of September, 2018, the City of Toronto will launch an online Source-to-Pay tool utilizing SAP Ariba and begin to migrate the City's Solicitations (RFQs, RFPs etc.) from being posted on the City's Online Call Document System to being posted through SAP Ariba. It is important for all Suppliers to register on the SAP Ariba network in order to continue to be able to access City of Toronto Solicitations. For more information on this transition please visit: Upcoming Changes to Bidding on City Contracts. 
 
Any questions about this transition should be directed to City Bids at: citybids@toronto.ca  
 
 
 
 
 
","City Hall, 19th Floor West Tower",,"Construction Services, Road - Curb - Sidewalk","February 26, 2019",Notice3-2019,https://wx.toronto.ca/inter/pmmd/calls.nsf/0/2E27D206D3A065788525839100766418/$file/NOIP 3-2019  19EY-102TU.pdf,***,"Request for Tender for Permanent repairs to Utility Cuts on arterial, collector and local roads within Ward 5 "
,,,,,,,,,
"Kysym, Christina","#Doc1628285358- Request for Tender for Permanent repairs to Utility Cuts on arterial, collector and local roads within Ward 1, 2, and 3 (Etobicoke York District) #19EY-101TU. 
 
 
LINK TO PUBLIC POSTING ARIBA DISCOVERY: 
		   
 
 
IMPORTANT NOTICE – Transition to City's new Source-to-pay tool – SAP Ariba 
 
As of September, 2018, the City of Toronto will launch an online Source-to-Pay tool utilizing SAP Ariba and begin to migrate the City's Solicitations (RFQs, RFPs etc.) from being posted on the City's Online Call Document System to being posted through SAP Ariba. It is important for all Suppliers to register on the SAP Ariba network in order to continue to be able to access City of Toronto Solicitations. For more information on this transition please visit: Upcoming Changes to Bidding on City Contracts. 
 
Any questions about this transition should be directed to City Bids at: citybids@toronto.ca  
 
 
 
 
 
","City Hall, 19th Floor, West Tower",,"Construction Services, Road - Curb - Sidewalk","February 20, 2019",Notice2-2019,"https://wx.toronto.ca/inter/pmmd/calls.nsf/0/14AE0B77C84FE0CF85258391006EA5A6/$file/2-2019  19EY-101TU  Website posting info_.pdf,https://wx.toronto.ca/inter/pmmd/calls.nsf/0/14AE0B77C84FE0CF85258391006EA5A6/$file/NOIP-2-2019.pdf",***,"Request for Tender for Permanent repairs to Utility Cuts on arterial, collector and local roads within Ward 1, 2, and 3 "
,,,,,,,,,
"Suits, Martin","Security / Bid Deposit: 
 
Every Bidder shall submit with their Bid a Bid Bond in the amount of 10% of the Bid amount and will agree to provide a Performance Bond and a Labour and Material Bond for the due and proper performance of the Work, each in the amount of 50% of the Contract amount including an extended 24 month warranty period. The Bonds will be issued by a licensed surety company authorized to transact business in the Province of Ontario and shall be maintained in good standing until the fulfilment of the Contract. 
 
NOTE: 
 
This call document is only available for purchase and download through the City of Toronto's Online Call Document System: 
 . 
  
A non-refundable fee (shown above), is required for each call document.  
 
DRAWINGS AND SPECIFICATIONS 
 
The Tender Specifications and Drawings are available on CD to the bidders who have purchased the tender document. Bidders may pick up a copy of the CD from the Purchasing and Materials Management Division offices, 19th floor, West Tower, 100 Queen Street West during regular business hours (8.30 a.m. to 4.30 p.m.).  
 
Proof of Tender purchase will be required to pick-up the CD. The bidders who have not purchased the Tender document will have to do so before being given a copy of the CD 
 
Scope of Work	Summary: 
 
The following is a summary for the reference of bidders. 
Please note that full specifications and drawings are provided in a separate CD package accompanying this tender document. 
 
The scope of work involved in this Tender shall consist of the supply and installation of all materials as detailed on the project drawings and specifications; including all labour, materials, tools, equipment, overhead, profit, coordination, warranty, etc. necessary for the completion of the work. No equipment, labour, materials, tools, etc. or storage facilities shall be provided by the City unless noted otherwise on the project drawings. 
 
 
 
 
","City Hall, 19th Floor West Tower",,"Construction Services, Mechanical Services","March 1, 2019",298-2018,"https://wx.toronto.ca/inter/pmmd/calls.nsf/0/A1F24E61C224109485258386006B9541/$file/298-2018 - NOIP.pdf,https://wx.toronto.ca/inter/pmmd/calls.nsf/0/A1F24E61C224109485258386006B9541/$file/298-2018 Viewing Copy Only.pdf,https://wx.toronto.ca/inter/pmmd/calls.nsf/0/A1F24E61C224109485258386006B9541/$file/298-2018 - Addendum No.1.pdf",***,Blower Building Rehabilitation and Upgrades at Ashbridges Bay Treatment Plant (TAB).
,,,,,,,,,
"Dares, Kasia","See viewing copy
 
 
 
 
","City Hall, 17th Floor West Tower",,"Construction Services, Mechanical Services","March 8, 2019",4305-19-0073,"https://wx.toronto.ca/inter/pmmd/calls.nsf/0/4F95F310078E87878525839900544A32/$file/Notice of Intended Procurement 4305-19-0073.pdf,https://wx.toronto.ca/inter/pmmd/calls.nsf/0/4F95F310078E87878525839900544A32/$file/4305-19-0073 Viewing Copy.pdf",***,Maintenance of BAS at Enercare Centre
,,,,,,,,,
